{
  "format": "squared-cartridge",
  "format_version": 1,

  "kind": "cartridge",
  "id": "{{id}}",
  "version": "{{version}}",

  "title": "{{title}}",
  "description": "Created by sqcart from a plain directory.",

  "cartridge": {
    "entry": {
      "module": "{{entry_module}}",
      "type": "lua-source",
      "lua_abi": "lua54"
    },
    "packages": [],
    "permissions": []
  }
}
